knowledge_point_type,question,option_A,option_B,option_C,option_D,answer,difficulty,bloom_level
稀疏矩阵的压缩存储,稀疏矩阵一般的压缩存储方法有两种，即 ()。,二维数组和三维数组,三元组和散列,三元组和十字链表,散列和十字链表,C,3,a
串的定义,空串与空格串（ ）。,相同,不相同,可能相同,无法确定,B,1,a
串的模式匹配算法,设有两个申 S1 与 S2，求串 S2 在 S1 中首次出现位置的运算称作（ ）。,连接,求子串,模式匹配,判子串,C,1,a
串的定义,串与普通的线性表相比较，它的特殊性体现在（ ）。,顺序的存储结构,链接的存储结构,数据元素是一个字符,数据元素可以任意,C,1,a
串的基本操作,设有串 S=‘Computer’，则其子串的数目是（ ）。,36,37,8,9,A,3,b
数组的定义,数组常用的两种基本操作是（ ）。,建立与查找,删除与查找,插人与索引,查找与修改,D,1,a
稀疏矩阵,对稀疏矩阵进行压缩存储，常用的两种方法是（ ）。,二元组和散列表,三元组表和十字链表,三角矩阵和对角矩阵,对角矩阵和十字链表,B,2,a
稀疏矩阵,采用稀疏矩阵的三元组表形式进行压缩存储，若要完对三元组表进行成转置，只要将行和列对换，这种说法（ ）。,正确,错误,无法确定,以上均不对,B,3,b
广义表的概念,一个广义表的表头总是一个广义表，这种说法（ ）。,正确,错误,无法确定,以上均不对,B,3,b
广义表的概念,一个广义表的表尾总是一个广义表，这种说法（ ）。,正确,错误,无法确定,以上均不对,A,3,b
广义表的表头表尾,广义表 ((a)) 的表头是（ ）。,（ ）,a,（a）,（（a））,C,3,b
广义表的表头表尾,广义表（（a））的表尾是（ ）。,（）,a,（a）,（（a））,A,3,b
广义表的表头表尾,广义表（（a），a）的表头是（ ）。,（ ）,a,（a）,（（a））,C,3,b
广义表的表头表尾,广义表（（a），a）的表尾是（ ）。,( ),a,（a）,（（a））,C,4,c
广义表的表头表尾,广义表（a，b，c）的表头是（ ）。,a,（a）,a，b,（b，c）,A,2,a
广义表的表头表尾,广义表（a，b，c）的表尾是（ ）。,b，c,（b，c）,a．b，c,（a，b，c）,B,2,a
广义表的操作,广义表 A 满足 Head（）= Tail（），则 A 为（）。,（）,（（））,（（），（））,（（），（），（））,B,5,d
二叉树的定义及其主要特性,"二叉树的深度为 k, 则二叉树最多有 () 个结点。",2k,2^(k-1),2^k-1,2k-1,C,3,a
二叉树的存储结构,用顺序存储的方法，将完全二叉树中所有结点按层逐个从左到右的顺序存放在一维数组 R [1..N] 中，若结点 R [i] 有右孩子，则其右孩子是 ()。,R [2i-1],R [2i+1],R [2i],R [2/i],B,4,b
二叉树的遍历,"设 a,b 为一棵二叉树上的两个结点，在中序遍历时，a 在 b 前面的条件是 ()。",a 在 b 的右方,a 在 b 的左方,a 是 b 的祖先,a 是 b 的子孙,B,4,b
二叉树的遍历,"设一棵二叉树的中序遍历序列:badce, 后序遍历序列:bdeca, 则二叉树先序遍历序列为 ()。",adbce,decab,debac,abcde,D,6,d
二叉树的定义及其主要特性,在一棵具有 5 层的满二叉树中结点总数为 ()。,31,32,33,16,A,4,b
二叉树的遍历,由二叉树的前序和后序遍历序列 () 惟一确定这棵二叉树。,能,不能,无法确定,以上均不对,B,4,b
二叉树的遍历,"某二叉树的中序序列为 ABCDEFG, 后序序列为 BDCAFGE, 则其左子树中结点数目为 ()。",3,2,4,5,C,6,d
哈夫曼树和哈夫曼编码,"若以 (4,5,6,7,8) 作为权值构造哈夫曼树，则该树的带权路径长度为 ()。",67,68,69,70,C,5,c
二叉树的存储结构,"将一棵有 100 个结点的完全二叉树从根这一层开始，每一层上从左到右依次对结点进行编号，根结点的编号为 1, 则编号为 49 的结点的左孩子编号为 ()。",98,99,50,48,A,5,c
栈在表达式求值中的应用,表达式 a*(b+c)-d÷ 的后缀表达式是 ()。,abcd+,abc+d,abc+d,#NAME?,B,5,c
二叉树的遍历,"对某二叉树进行先序遍历的结果为 ABDEFC, 中序遍历的结果为 DBFEAC, 则后序遍历的结果是 ()。",DBFEAC,DFEBCA,BDFECA,BDEFAC,B,6,d
树的定义,树最适合用来表示 ()。,有序数据元素,无序数据元素,元素之间具有分支层次关系的数据,元素之间无联系的数据,C,3,a
栈在表达式求值中的应用, 表达式 A(B+C)/(D-E+F) 的后缀表达式是 ()。,AB+C/D-E+F,ABC+D/E-F+,ABC+DE-F+/,ABCDED+/-+,C,5,c
线索二叉树,在线索二叉树中，t 所指结点没有左子树的充要条件是 ()。,t->left=NULL,t->ltag==1,t->ltag==1&&t->left==NULL,以上都不对,B,5,c
二叉树的遍历,任何一棵二叉树的叶结点在先序、中序和后序遍历序列中的相对次序 ()。,不发生改变,发生改变,不能确定,以上都不对,A,4,b
二叉树的定义及其主要特性,"假定在一棵二叉树中，度为 2 的结点数为 15, 度为 1 的结点数为 30, 则叶子结点数为 () 个。",15,16,17,47,B,4,b
二叉树的定义,在下列情况中，可称为二叉树的是 ()。,每个结点至多有两棵子树的树,哈夫曼树,每个结点至多有两棵子树的有序树,每个结点只有一棵子树,B,4,b
二叉树的存储结构,用顺序存储的方法，将完全二叉树中所有结点按层逐个从左到右的顺序存放在一维数组 R [1..N] 中，若结点 R [i] 有左孩子，则其左孩子是 ()。,R [2i-1],R [2i+1],R [2i],R [2/i],C,4,b
二叉树的定义,下面说法中正确的是 ()。,度为 2 的树是二叉树,度为 2 的有序树是二叉树,子树有严格左右之分的树是二叉树,子树有严格左右之分，且度不超过 2 的树是二叉树,D,4,b
树、森林与二叉树的转换,树的先根序列等同于与该树对应的二叉树的 ()。,先序序列,中序序列,后序序列,层序序列,A,4,b
二叉树的定义,按照二叉树的定义，具有 3 个结点的二叉树有 () 种。,3,4,5,6,C,4,b
哈夫曼树和哈夫曼编码,"由权值为 3,6,7,2,5 的叶子结点生成一棵哈夫曼树，它的带权路径长度为 ()。",51,23,53,74,A,5,c
二叉树的遍历,在二叉树后序遍历中，任一个结点均在其子女结点后面，这种说法（ ）。,,不正确,无法判断,以上均不对,A,1,a
二叉树的遍历,在二叉树先序遍历中，任一个结点均在其子女结点前面，这种说法（ ）。,正确,不正确,无法判断,以上均不对,A,1,a
二叉树的性质,设深度为 h 的二叉树上只有叶子结点和同时具有左右子树的结点，则此类二叉树中所包含的结点数目至少为（ ）。,2h,2h,2h＋1,2h-l,D,4,c
二叉树的性质,二叉村第 k 层上最多有（ ）个结点。,2k,2k-1,2k-1,2k+1,C,1,a
二叉树的性质,二叉树的深度为 k，则二叉树最多有（ ）个结点。,2k,2k-1,2k-1,2k -1,C,1,a
二叉树的遍历,设某一二叉树先序遍历为 abdec，中序遍历为 dbeac，则该二叉树后序遍历的顺序是（ ）。,abdec,debac,debca,abedc,C,5,d
二叉树的遍历,设某一二叉树中序遍历为 badce，后序遍历为 bdeca，则该二叉树先序遍历的顺序是（ ）。,adbec,decab,debac,abode,D,5,d
树、森林与二叉树的转换,将一棵树 T 转换为一棵二叉树 T2，则 T 的先序遍历是 T2 的（ ）。,先序,中序,后序,无法确定,A,3,b
树、森林与二叉树的转换,将一棵树 T 转换为一棵二叉树 T2，则 T 的后序遍历是 T2 的（ ）。,先序,中序,后序,无法碉定,B,3,b
树的定义,树最适合于用来表示（ ）。,线性结构的数据,顺序结构的数据,元素之间无前驱和后继关系的数据,元素之间有包含和层次关系的数据,D,1,a
二叉树的遍历,二叉树的叶子结点在先序、中序和后序遍历过程中的相对秩序（ ）。,发生改变,不发生改变,无法确定,以上均不正确,B,3,b
二叉树的性质,设一棵二叉树度为 2 的结点数是 7，度为 1 的结点数是 6，则叶子结点数是（ ）。,6,7,8,9,C,2,a
完全二叉树的顺序存储,用顺序存储的方法，将完全二叉树中所有结点按层逐个从左到右的顺序存放在一维数组 R [1．．n] 中，若结点 R [i] 有左孩子，则其左孩子是（ ）。,R [2i-1],R [2i+1],R [2i],R [2/i],C,2,a
完全二叉树的顺序存储,用顺序存储的方法，将完全二叉树中所有结点按层逐个从左到右的顺序存放在一维数组 R [1．．n] 中，若结点 R [i] 有右孩子，则其右孩子是（ ）。,R [2i-1],R [2i＋l],R [2i],R [2/i],B,2,a
二叉树的遍历,一棵非空的二叉树，先序遍历与后序遍历正好相反，则该二叉树满足（ ）。,无左孩子,无右孩子,只有一个叶子结点,任意二叉树,C,4,c
二叉树的遍历,设 a、b 为一棵二叉树的两个结点，在后序遍历中，a 在 b 前的条件是（ ）。,a 在 b 上方,a 在 b 下方,a 在 b 左方,a 在 b 右方,C,3,b
线索二叉树,线索二叉树是一种（ ）。,逻辑结构,线性结构,逻辑和线性结构,物理结构,D,2,a
线索二叉树,N 个结点的线索二叉树中，线索的数目是（ ）。,N-1,N＋1,2N,2N－1,B,4,c
哈夫曼树和哈夫曼编码,权值为｛l，2，6，8｝的四个结点构成的哈夫曼树的带权路径长度是（ ）。,18,28,19,29,B,4,c
线索二叉树,实现任意二叉树的后序遍历的非递归算法而不使用栈结构，最佳方案是二叉村采用（ ）存储结构。,二叉链表,广义表存储结构,三叉链表,顺序存储结构,C,5,d
满二叉树的性质,对一个满二叉树，m 个树叶，k 个分枝结点，n 个结点，则（ ）。,n＝m＋1,m+1=2n,m＝k-1,n=2k+1,D,3,b
平衡二叉树,具有五层结点的二叉平衡树至少有（ ）个结点。,10,12,15,17,B,5,d
二叉树的遍历,设 n，m 为一棵二叉树上的二个结点，在中序遍历时，n 在 m 前的条件是（ ）。,n 在 m 右方,n 是 m 祖先,n 在 m 左方,n 是 m 子孙,C,2,a
线索二叉树,线索二又树是一种（ ）结构。,逻辑,逻辑和物理,物理,线性,C,2,a
完全二叉树的顺序存储,将一棵有 100 个结点的完全二又树从根这一层开始，每一层上从左到右依次对结点进行编号，根结点的编号为 1，则编号为 49 的结点的左孩子编号为（ ）。,98,99,50,48,A,3,b
图的存储结构 - 邻接矩阵法,对于具有 n 个顶点的图，若采用邻接矩阵表示，则该矩阵的大小为 ()。,n,n×n,n-1,(n-1)²,B,3,a
图的遍历与图的连通性,如果从无向图的任一顶点出发进行一次深度优先搜索即可访问所有顶点，则该图一定是 ()。,完全图,连通图,有回路,一棵树,B,3,a
关键路径,关键路径是事件结点网络中 ()。,从源点到汇点的最长路径,从源点到汇点的最短路径,最长的回路,最短的回路,A,4,b
拓扑排序,下面 () 可以判断出一个有向图中是否有环 (回路)。,广度优先遍历,拓扑排序,求最短路径,求关键路径,B,4,b
图的存储结构 - 邻接矩阵法,带权有向图 G 用邻接矩阵 A 存储，则顶点 i 的入度等于 A 中 ()。,第 i 行非无穷的元素之和,第 i 列非无穷的元素个数之和,第 i 行非无穷且非 0 的元素个数,第 i 行与第 i 列非无穷且非 0 的元素之和,B,5,c
图的遍历 - 深度优先搜索,采用邻接表存储的图，其深度优先遍历类似于二叉树的 ()。,中序遍历,先序遍历,后序遍历,按层次遍历,B,4,b
图的存储结构 - 邻接矩阵法,无向图的邻接矩阵是一个 ()。,对称矩阵,零矩阵,上三角矩阵,对角矩阵,A,3,a
队列的顺序存储结构,当利用大小为 N 的数组存储循环队列时，该队列的最大长度为 ()。,N,N+1,N-1,N-2,C,4,b
图的存储结构 - 邻接表法,邻接表是图的一种 ()。,顺序存储结构,链式存储结构,索引存储结构,散列存储结构,B,3,a
拓扑排序,下面有向图所示的拓扑排序的结果序列是 ()。,125634,516234,123456,521643,A,5,c
图的基本概念,在无向图中定义顶点 vi 与 vj 之间的路径为从 vi 到 vj 的一个 ()。,顶点序列,边序列,权值总和,边的条数,A,3,a
图的存储结构 - 邻接表法,在有向图的逆邻接表中，每个顶点邻接表链接着该顶点所有 () 邻接点。,入边,出边,入边和出边,不是出边也不是入边,A,4,b
图的基本概念," 设 G1=(V 1,E1)和 G2=(V2 ,E2)为两个图，如果V1⊆V2, E1⊆E2则称 ()。",G1 是 G2 的子图,G2 是 G1 的子图,G1 是 G2 的连通分量,G2 是 G1 的连通分量,A,3,a
图的存储结构 - 邻接矩阵法,已知一个有向图的邻接矩阵表示，要删除所有从第 i 个结点发出的边，应 ()。,将邻接矩阵的第 i 行删除,将邻接矩阵的第 i 行元素全部置为 0,将邻接矩阵的第 i 列删除,将邻接矩阵的第 i 列元素全部置为 0,B,4,b
拓扑排序,任一个有向图的拓扑序列 ()。,不存在,有一个,一定有多个,有一个或多个,D,4,b
图的基本概念,在一个无向图 G 中，所有顶点的度数之和等于所有边数之和的（ ）倍。,l/2,1,2,4,C,1,a
图的基本概念,在一个有向图中，所有顶点的入度之和等于所有顶点的出度之和的（）倍。,l/2,1,2,4,B,1,a
图的连通性,一个具有 n 个顶点的无向联通图至少包含（ ）条边。,n,n＋1,n-1,n/2,C,1,a
完全图的概念,一个具有 n 个顶点的无向完全图包含（ ）条边。,n (n-l),n (n+l),n (n-l)/2,n (n+l)/2,C,1,a
完全图的概念,一个具有 n 个顶点的有向完全图包含（ ）条边。,n (n-1),n (n+l),n (n-l)/2,n (n+l)/2,A,1,a
图的存储结构,对于具有 n 个顶点的图，若采用邻接矩阵表示，则该矩阵的大小为（ ）。,n,n²,n-1,(n-l)²,B,1,a
邻接表法,对于一个具有 n 个顶点和 e 条边的无向图，若采用邻接表表示，则表头向量的大小为（ ）。,n,e,2n,2e,A,1,a
邻接表法,对于一个具有 n 个顶点和 e 条边的无向图，若采用邻接表表示，则所有顶点邻接表中的结点总数为（ ）。,n,e,2n,2e,D,2,a
邻接表法,在有向图的邻接表中，每个顶点邻接链表链接着该顶点所有（ ）邻接点。,入边,出边,入边和出边,不是入边也不是出边,B,2,a
逆邻接表法,在有向图的逆邻接表中，每个顶点邻接链表链接着该顶点所有（ ）邻接点。,入边,出边,入边和出边,不是人边也不是出边,A,2,a
图的遍历,下列说法中不正确的是（ ）。,无向图中的极大连通子图称为连通分量,连通图的广度优先搜索中一般要采用队列来暂存刚访问过的顶点,图的深度优先搜索中一般要采用栈来暂存刚访问过的顶点,有向图的遍历不可采用广度优先搜索方法,D,3,b
生成树的概念,"设无向连通图 G=(V, E) 和 G’= (V’, E’)，如果 G’为 G 的生成树，则下列说法中不正确的是（ ）。",G’为 G 的连通分量,G’为 G 的无环子图,G’为 G 的子图,G’为 G 的极小连通子图且 V’＝V,A,3,b
图的连通性,如果无向图 G 必须进行二次广度优先搜索才能访问其所有顶点，则下列说法中不正确的是（ ）。,G 肯定不是完全图,G 一定不是连通图,G 中一定有回路,G 有二个连通分量,C,3,b
图的存储结构,邻接表是图的一种（ ）。,顺序存储结构,链式存储结构,索引存储结构,散列存储结构,B,1,a
图的连通性,如果从无向图的任一顶点出发进行一次深度优先搜索即可访问所有顶点，则该图一定是（ ）。,完全图,连通图,有回路,一棵树,B,1,a
图的遍历,下列有关图遍历的说法不正确的是（ ）。,连通图的深度优先搜索是一个递归过程,图的广度优先搜索中邻接点的寻找具有 “先进先出” 的特征,非连通图不能用深度优先搜索法,图的遍历要求每一顶点仅被访问一次,C,3,b
生成树的概念,一个无向连通图的生成树是含有该连通图的全部顶点的（ ）。,极小连通子图,极小子图,极大连通子图,极大子图,A,2,a
邻接矩阵法,无向图的邻接矩阵是一个（ ）。,对称矩阵,零矩阵,上三角矩阵,对角矩阵,A,1,a
图的深度优先搜索,已知一个图如下图所示，若从顶点 a 出发按深度优先搜索法进行遍历，则可能得到的一种顶点序列为（ ）。,abecdf,acfebd,acebfd,acfdeb,C,4,c
图的基本概念,"在一个有向图中,所有顶点的入度之和等于所有顶点的出度之和的()倍。",1月2日,1,2,4,B,3,a
图的遍历-广度优先搜索,图的广度优先遍历类似于二叉树的()。,先序遍历,中序遍历,后序遍历,层序遍历,D,3,a
图的遍历-深度优先搜索,图的深度优先遍历类似于二叉树的()。,先序遍历,中序遍历,后序遍历,层序遍历,A,3,a
最小生成树-Prim算法,"用Prim算法求一个连通的带权图的最小代价生成树,在算法执行的某时刻,已选取的顶点集合U={1,2,3},已选取的边集合TE={(1,2),(2,3)},要选取下一条权值最小的边,应当从()组中选取。","所有顶点u∈U,顶点v∈V-U的边(u,v)","所有顶点u∈V-U,顶点v∈V-U的边(u,v)","所有顶点u∈V-U,顶点v∈U的边(u,v)","所有顶点u∈U,顶点v∈U的边(u,v)",A,4,b
图的基本概念,"在一个具有n个顶点的无向完全图中,包含有()条边。",n(n-1)/2,n(n-1),n(n+1)/2,n²,A,3,a
图的基本概念,"在一个具有n个顶点的有向完全图中,包含有()条边。",n(n-1)/2,n(n-1),n(n+1)/2,n²,B,3,a
关键路径,"在AOE网中,关键路径上活动的时间延长多少,整个工程的时间也就随之延长多少。因此,要想缩短整个工程的工期,必须加快()上活动的进度。",最短路径,最长路径,关键路径,所有路径,C,4,b
最短路径-Dijkstra算法,Dijkstra算法用于求解图中()。,所有顶点到某一顶点的最短路径,某一顶点到所有顶点的最短路径,所有顶点到所有顶点的最短路径,图的最小生成树,B,4,b
最短路径-Floyd算法,Floyd算法用于求解图中()。,所有顶点到某一顶点的最短路径,某一顶点到所有顶点的最短路径,所有顶点到所有顶点的最短路径,图的最小生成树,C,4,b
图的存储结构-邻接表法,"在有向图的邻接表存储结构中,顶点v在邻接表中出现的次数是()。",顶点v的度,顶点v的出度,顶点v的入度,依附于顶点v的边数,C,4,b
最小生成树-Kruskal算法,Kruskal算法的时间复杂度为()。,O(n),O(n²),O(eloge),O(n³),C,4,b
最小生成树-Prim算法,Prim算法的时间复杂度为()。,O(n),O(n²),O(eloge),O(n³),B,4,b
图的遍历-深度优先搜索,"对于一个具有n个顶点和e条边的无向图,若采用邻接表表示,则所有顶点邻接表中的边结点总数为()。",e/2,e,2e,n+e,C,4,b
图的遍历-广度优先搜索,广度优先遍历类似于二叉树的()。,先序遍历,中序遍历,后序遍历,层次遍历,D,3,a
图的基本概念,"在一个无向图中,所有顶点的度数之和等于边数的()倍。",1月2日,1,2,4,C,3,a
图的存储结构-邻接矩阵法,"在一个有n个顶点的无向图中,若采用邻接矩阵表示,则该矩阵的大小为()。",n,n×n,n-1,n+1,B,3,a
图的存储结构-邻接表法,"在一个有n个顶点和e条边的无向图中,若采用邻接表表示,则表头向量的大小为()。",n,n+1,n-1,e,A,3,a
图的存储结构-邻接表法,"在一个有n个顶点和e条边的无向图中,若采用邻接表表示,则表中的边结点总数为()。",e/2,e,2e,n+e,C,3,a
图的遍历-深度优先搜索,"已知一个图的邻接表存储结构,若要删除所有从顶点v发出的边,则需要遍历()。",整个邻接表,邻接表中顶点v的单链表,邻接表中所有顶点的单链表,邻接表中顶点v的单链表和所有顶点的单链表,B,4,b
图的遍历-广度优先搜索,"在图的广度优先遍历算法中,需要使用的辅助数据结构是()。",栈,队列,树,图,B,3,a
图的遍历-深度优先搜索,"在图的深度优先遍历算法中,需要使用的辅助数据结构是()。",栈,队列,树,图,A,3,a
图的基本概念,"一个有n个顶点的无向连通图,其边数至少为()。",n-1,n,n+1,nlogn,A,3,a
图的基本概念,"一个有n个顶点的有向强连通图,其边数至少为()。",n-1,n,n+1,n(n-1),B,4,b
图的遍历-深度优先搜索,"在一个有向图中,若存在一个顶点v,从该顶点出发可以到达图中所有其他顶点,则称该图为()。",强连通图,弱连通图,单侧连通图,连通图,C,4,b
图的遍历-深度优先搜索,"在一个有向图中,若对于每一对顶点u和v,都存在从u到v和从v到u的路径,则称该图为()。",强连通图,弱连通图,单侧连通图,连通图,A,3,a
图的遍历-深度优先搜索,"在一个有向图中,若将其边视为无向边后得到的无向图是连通的,则称该有向图为()。",强连通图,弱连通图,单侧连通图,连通图,B,3,a
图的基本概念,"在一个具有n个顶点的无向图中,若要保证图是连通的,则至少需要()条边。",n-1,n(n-1)/2,n(n-1),n,A,3,a
图的基本概念,"在一个具有n个顶点的有向图中,若要保证图是强连通的,则至少需要()条边。",n-1,n,n(n-1)/2,n(n-1),B,4,b
图的遍历-深度优先搜索,"在一个有向图中,若存在一个顶点v,从该顶点出发可以到达图中所有其他顶点,则称该图为()。",强连通图,弱连通图,单侧连通图,连通图,C,4,b
图的遍历-深度优先搜索,"在一个有向图中,若对于每一对顶点u和v,都存在从u到v和从v到u的路径,则称该图为()。",强连通图,弱连通图,单侧连通图,连通图,A,3,a
图的遍历-深度优先搜索,"在一个有向图中,若将其边视为无向边后得到的无向图是连通的,则称该有向图为()。",强连通图,弱连通图,单侧连通图,连通图,B,3,a
图的基本概念,"在一个具有n个顶点的无向图中,若要保证图是连通的,则至少需要()条边。",n-1,n(n-1)/2,n(n-1),n,A,3,a
图的基本概念,"在一个具有n个顶点的有向图中,若要保证图是强连通的,则至少需要()条边。",n-1,n,n(n-1)/2,n(n-1),B,4,b
顺序查找,在顺序表中进行顺序查找，其平均查找长度为 ()。,(n+1)/2,n/2,n,log₂n,A,3,a
折半查找,对长度为 n 的有序顺序表进行折半查找，其平均查找长度为 ()。,O (log₂n),O (n),O (nlog₂n),O (n²),A,4,b
折半查找,"折半查找有序表 (4,6,10,12,18,20,24,26,30,32,36), 若查找元素 20, 需进行 () 次比较。",2,3,4,5,B,4,b
分块查找,分块查找中，若索引表和块内均采用顺序查找，则其平均查找长度为 ()。,O (log₂n),O (√n),O (n),O (nlog₂n),B,5,c
二叉排序树 (BST),在二叉排序树中，左子树上所有结点的值均 () 根结点的值。,<,>,=,≤,A,3,a
二叉排序树 (BST),在二叉排序树中，右子树上所有结点的值均 () 根结点的值。,>,<,=,≤,A,3,a
二叉排序树 (BST),在二叉排序树中，中序遍历序列是 () 序列。,无序,有序,逆序,随机,B,3,a
平衡二叉树,平衡二叉树中每个结点的平衡因子的绝对值不超过 ()。,0,1,2,3,B,3,a
顺序查找,顺序查找方法适合于存储结构为（ ）的线性表,散列存储,索引存储,散列存储或索引存储,顺序存储或链接存储,D,1,a
折半查找,对线性表进行二分查找的时候，要求线性表必须（ ）。,以顺序存储方式,以链接存储方式,以顺序存储方式，且数据元素有序,以链接存储方式，且数据元素有序,C,1,a
分块查找,如果要求一个线性表既能较快地查找，又能动态适应变化要求，可以采用（ ）查找方法。,顺序,分块,折半,散列,B,2,b
线性表的存储结构,对于一个线性表，若要求既能进行较快地插入和删除，又要求存储结构能够反映数据元素之间的逻辑关系，则应该 ( ) 。,以顺序存储方式,以链接存储方式,以索引存储方式,以散列存储方式,B,2,b
顺序表的特点,在线性表的存储结构中，（ ）查找、插入和删除速度慢，但顺序存储和随机存取第 i 个元素速度快。,顺序表,链接表,散列表,索引表,A,2,a
顺序表的特点,在 ( ) 上查找和存取速度快，但插入和删除速度慢。,顺序表,链接表,顺序有序表,散列表,A,2,a
散列表的特点,在 ( ) 上查找、插入和删除速度快，但不能进行顺序存取。,顺序表,链接表,顺序有序表,散列表,D,2,a
链接表的特点,在 ( ) 上插入、删除和顺序存取速度快，但查找速度慢。,顺序表,链接表,顺序有序表,散列表,B,2,a
顺序查找的性能,采用顺序查找方法查找长度为 n 的线性表，查找每个元素的平均比较次数为 ( ),n,n/2,(n+1)/2,(n-1)/2,C,2,a
顺序查找的时间复杂度,顺序查找具有 n 个元素的线性表，其时间复杂度为 ( ) 。,O (n),O (log2n),O (n²),O (nlog2n),A,1,a
折半查找的时间复杂度,折半查找具有 n 个元素的线性表，其时间复杂度为 ( ) 。,O (n),O (log2n),O (n²),O (nlog2n),B,1,a
折半查找的应用,"己知一个有序表为 (11,22,33,44,55,66,77, 88,99), 则折半查找元素 55 需要比较 ( ) 次。",1,2,3,4,C,2,b
顺序查找的应用,"已知一个有序表为 (11,22,33,44,55,66,77,88,99), 则顺序查找元素 55 需要比较 ( ) 次。",3,4,5,6,C,2,b
顺序查找和折半查找的存储要求,顺序查找法与二分查找法对存储结构的要求是 ( ) 。,顺序查找与二分查找均只是适用于顺序表,顺序查找与二分查找均既适用于顺序表，也适用于链表,顺序查找只是适用于顺序表,二分查找适用于顺序表,D,2,b
动态查找表的概念,在对查找表的查找过程中，若被查找的数据元素不存在，则把该数据元素插到集合中。这种方式主要适合于 ( ) 。,静态查找表,动态查找表,静态查找表与动态查找表,两种表都不适合,B,2,a
