knowledge_point_type,question,option_A,option_B,option_C,option_D,answer,difficulty,bloom_level
折半查找的步骤,若用二分查找取得的中间位置元素关键字值大于被查找值，则说明被查找值位于中间值的前面，下次的查找区间为从原开始位置至 ( ) 。,该中间位置,该中间位置 - 1,该中间位置 + 1,该中间位置 1/2,B,2,b
二叉排序树的遍历,二叉排序树（ ）遍历序列是从小到大有序的。,先序,中序,后序,层序,B,1,a
B 树及其基本操作,m 阶 B 树中每个非叶子结点至少有 () 棵子树。,m/2,⌈m/2⌉,⌊m/2⌋,m-1,B,5,c
二叉排序树 (BST),在二叉排序树中，右子树上所有结点的值均 () 根结点的值。,>,<,=,≤,A,3,a
二叉排序树 (BST),在二叉排序树中，中序遍历序列是 () 序列。,无序,有序,逆序,随机,B,3,a
散列表的基本概念,散列函数有一个共同的性质，即函数值应当以 () 概率取其值域的每个值。,最大,最小,均匀,随机,C,4,b
散列表处理冲突的方法,处理散列冲突的方法不包括 ()。,线性探测法,链地址法,二分法,再哈希法,C,3,a
散列查找及性能分析,散列查找的平均查找长度 ()。,与处理冲突方法无关,与散列函数无关,与散列表长度无关,与装填因子有关,D,4,b
排序的定义,排序的稳定性是指 ()。,排序算法的时间复杂度稳定,排序算法的空间复杂度稳定,排序前后相同关键字的相对顺序不变,排序前后相同关键字的绝对顺序不变,C,3,a
直接插入排序,直接插入排序的时间复杂度为 ()。,O (n),O (n²),O (nlog₂n),O (log₂n),B,3,a
冒泡排序,冒泡排序在最好情况下的时间复杂度为 ()。,O (n),O (n²),O (nlog₂n),O (log₂n),A,4,b
快速排序,快速排序在平均情况下的时间复杂度为 ()。,O (n),O (n²),O (nlog₂n),O (log₂n),C,4,b
简单选择排序,简单选择排序的时间复杂度为 ()。,O (n),O (n²),O (nlog₂n),O (log₂n),B,3,a
堆排序,堆排序的时间复杂度为 ()。,O (n),O (n²),O (nlog₂n),O (log₂n),C,4,b
归并排序,归并排序的时间复杂度为 ()。,O (n),O (n²),O (nlog₂n),O (log₂n),C,4,b
基数排序,基数排序的时间复杂度为 ()。,O (n+k),O (n²),O (nk),O (klog₂n),C,5,c
基数排序,基数排序的时间复杂度为 ()。,O (n+k),O (n²),O (nk),O (klog₂n),C,5,c
插入排序的稳定性,直接插入排序是一种 () 的排序算法。,不稳定,稳定,外部,非线性,B,3,a
快速排序的最坏情况,快速排序在最坏情况下的时间复杂度为 ()。,O (n),O (n²),O (nlog₂n),O (log₂n),B,4,b
归并排序的稳定性,归并排序是一种 () 的排序算法。,不稳定,稳定,外部,选择,B,3,a
堆排序的稳定性,堆排序是一种 () 的排序算法。,稳定,不稳定,外部,插入,B,3,a
希尔排序的稳定性,希尔排序是一种 () 的排序算法。,稳定,不稳定,外部,交换,B,3,a
冒泡排序的稳定性,冒泡排序是一种 () 的排序算法。,稳定,不稳定,外部,选择,A,3,a
排序算法的比较,以下排序算法中，稳定的是 ()。,快速排序,堆排序,归并排序,希尔排序,C,4,b
排序算法的比较,以下排序算法中，不稳定的是 ()。,直接插入排序,冒泡排序,简单选择排序,归并排序,C,4,b
外部排序的基本概念,外部排序是指 ()。,排序过程中需访问外存,不需要使用内存,排序算法复杂,排序时间长,A,3,a
排序算法的比较次数,在所有的排序方法中，关键字比较的次数与记录初始排列秩序无关的是（）。,冒泡排序,希尔排序,直接选择排序,直接插人排序,C,3,b
插入排序的概念,从未排序序列中依次取出元素与已经排好序的序列中的元素作比较，将其放入已排序序列的正确位置上，此方法称为（）。,插人排序,选择排序,交换排序,归并排序,A,1,a
选择排序的概念,从未排序序列中挑选元素，并将其放人已排序序列的一端，此方法称为（）。,插入排序,交换排序,选择排序,归并排序,C,1,a
归并排序的概念,依次将每两个相邻的有序表合并成一个有序表的排序方法称为（）。,插人排序,交换排序,选择排序,归并排序,D,1,a
交换排序的概念,当两个元素出现逆序的时候就交换位置，这种排序方法称为（）。,插人排序,交换排序,选择排序,归并排序,B,1,a
快速排序的概念,每次把待排序的区间划分为左、右两个子区间，其中左区间中的记录的关键字均小于等于基准记录的关键字，右区间中记录的关键字均大于等于基准记录的关键字，这种排序称为（）。,插人排序,快速排序,堆排序,归并排序,B,1,a
插入排序的时间复杂度,在正常情况下，直接插人排序的时间复杂度为（）。,O (log2n),O (n),O (n log2n),O (n²),D,1,a
冒泡排序的时间复杂度,在正常情况下，冒泡排序的时间复杂度为（）。,O (log2n),O (n),O (nlog2n),O (n²),D,1,a
归并排序的趟数,在归并排序中，归并趟数的数量级为（）。,O (log2n）,O (n),O (nlog2n),O (n²),A,2,b
归并排序的性能,在归并排序中，每趟需要进行的记录比较和移动次数的数量级为（）。,O (log2n）,O (n),O (nlog2n),O (n²),B,2,b
归并排序的时间复杂度,归并排序算法时间复杂度为（）。,O (log2n）,O (n),O (nlog2n),O (n²),C,2,b
快速排序的平均时间复杂度,平均情况下，快速排序的时间复杂度为（）。,O (log2n）,O (n),O (nlog2n),O (n²),C,2,b
快速排序的最坏时间复杂度,最坏情况下，快速排序的时间复杂度为（）。,O（log2n）,O (n),O (nlog2n),O (n²),D,2,b
堆排序的性能,堆排序中，在每次筛运算中，记录比较和移动次数的数量级为（）。,O（log2n）,O (n),O (nlog2n),O (n²),A,3,c
堆排序的时间复杂度,堆排序算法时间复杂度为（）。,O（log2n）,O (n),O (nlog2n),O (n²),C,2,b
堆排序的应用,设有 800 条记录，希望用最快的方法挑选出其中前 10 个最大的元素，最好选用（）。,插人排序,快速排序,堆排序,归并排序,C,3,c
插入排序的最佳情况,在待排序元素基本有序的情况下，效率最高的排序方法是（）。,插入排序,快速排序,堆排序,归并排序,A,2,b
归并排序的空间复杂度,下面几种排序方法中，要求内存量最大的是（）。,插人排序,交换排序,选择排序,归并排序,D,2,b
排序算法的稳定性,在下列排序方法中，关键字比较的次数与记录的初始排列秩序无关的是（）方法。,希尔排序,冒泡排序,插人排序,选择排序,D,3,b
快速排序的最坏情况,快速排序方法在（）情况下最不利于发挥其长处。,要排序的数据量大大,要排序的数据中含有多个相同值,要排序的数据已基本有序,要排序的数据个数为奇数,C,2,b
二叉排序树的深度,若构造一棵具有 n 个结点的二又树排序，在最坏的情况下，其深度不会超过（）。,n/2,n,(n＋l)/2,n＋l,B,3,c
稳定排序算法,考察下列排序算法的稳定性，（ ）是稳定的排序算法。,直接插人排序、归并排序、冒泡排序,简单选择排序,快速排序,堆排序、希尔排序,A,3,c
内部排序算法的应用,当待排序序列基本有序时，最佳的排序算法是 ()。,快速排序,堆排序,冒泡排序,归并排序,C,4,b
内部排序算法的应用,当待排序序列长度 n 较小时，最佳的排序算法是 ()。,直接插入排序,快速排序,堆排序,归并排序,A,4,b
外部排序的基本概念,外部排序的基本操作是 ()。,归并和置换,排序和合并,置换 - 选择和归并,索引和排序,C,4,b
多路平衡归并与败者树,多路平衡归并中，使用败者树的目的是 ()。,减少归并次数,减少外存读写次数,提高内排序效率,减少内存占用,B,5,c
置换 - 选择排序,置换 - 选择排序生成的初始归并段长度 ()。,固定为内存工作区大小 ,平均为内存工作区大小的 2 倍 ,小于内存工作区大小 ,大于内存工作区大小 ,B,5,c
最佳归并树,构造最佳归并树时，应使权值 () 的叶结点尽量靠近根结点。,最大,最小,中等,任意,B,5,c
B + 树的基本概念,m 阶 B + 树中，非叶子结点的子树个数范围是 ()。,"[1, m]","[⌈m/2⌉, m]","[⌊m/2⌋, m]","[2, m]",B,5,c
外部排序的基本概念,外部排序的主要特点是 ()。,排序过程中需多次访问外存,排序数据量需小于内存容量,排序算法完全不需要内存参与,只能对磁盘文件进行排序,A,3,a
外部排序的基本步骤,外部排序的基本步骤是 ()。,生成初始归并段和多路归并,排序和索引,置换选择和败者树构造,内排序和外排序交替进行,A,4,b
置换 - 选择排序,置换 - 选择排序生成的初始归并段的平均长度约为 ()。,内存工作区大小的 1 倍,内存工作区大小的 2 倍,内存工作区大小的 1.5 倍,与内存工作区大小无关,B,5,c
多路平衡归并与败者树,败者树在多路归并中的主要作用是 ()。,减少磁盘读写次数,减少内存占用,减少比较次数,提高归并路数,C,5,c
最佳归并树,构造最佳归并树时，应使权值较小的叶结点尽量 () 根结点。,远离,靠近,随机分布于,位于,B,4,b
